{
  "run_id": "moonshine_mash_distill_20260217_r1",
  "stage_id": "stage_d_claude_finisher_v2",
  "role": "finisher_polisher",
  "state_hash_in": "stage_c:gate_a_pass_gate_b_pass_adjudicated_forward",
  "state_hash_out": "stage_d:prompt_ready_pending_execution",
  "files_changed": [
    "docs/CLAUDE_FINISHER_MASTER_PROMPT_20260217.md",
    "AGENTS.md",
    "README.md",
    "CONTEXT.md",
    "MEMORY.md"
  ],
  "verification": {
    "checks": [
      "Gate A artifacts still present and aligned",
      "Gate B core artifacts still present and aligned",
      "Stage C adjudication packet exists and signals forward",
      "Stage D master prompt created for no-MCP Claude execution"
    ],
    "status": "partial",
    "evidence": [
      "reports/token_ledger.json contains canonical and distilled counters",
      "reports/moonshine_distillation_manifest.json exists with in_band budget status",
      "visualizations/distilled_corpus_dashboard.png exists",
      "visualizations/quality_metrics_distilled_timeseries.png exists",
      "Residual code caveat found: moonshine_corpus_analyzer.py still has tone_shift=0.0 TODO"
    ]
  },
  "result": {
    "summary": "Forward to Claude Stage D finisher using the new master prompt. Most release artifacts are in place, but one residual implementation caveat must be explicitly closed before final release signal.",
    "artifacts": [
      "docs/CLAUDE_FINISHER_MASTER_PROMPT_20260217.md",
      "docs/RELEASE_ALIGNMENT_20260217.md",
      "docs/HANDOFF_PACKET_20260217_STAGE_C_ADJUDICATION.json",
      "docs/EXECUTION_LOG_20260217.json",
      "STATE_SNAPSHOT_20260217.md",
      "docs/STATE_SNAPSHOT_20260217.md"
    ],
    "risks": [
      "tone_shift placeholder remains in moonshine_corpus_analyzer.py and conflicts with full-closure language",
      "Final release should not be marked complete until caveat is implemented or accepted as documented debt",
      "repro_manifest checksum scope still limited and may need explicit acceptance"
    ]
  },
  "next_actions": [
    "Run docs/CLAUDE_FINISHER_MASTER_PROMPT_20260217.md in Claude",
    "Close tone_shift caveat in code or explicitly downgrade claims with debt acceptance",
    "Re-run strict validation and targeted SQL QC checks",
    "Update RELEASE_ALIGNMENT and Stage D handoff packet with final signal",
    "Set signal_type to forward only when caveat closure is complete"
  ],
  "signal_type": "forward",
  "coverage": {
    "selected_tools": [
      "bb7_exo_bootstrap",
      "bb7_exo_list_tool_categories",
      "bb7_exo_category_specific_tools",
      "bb7_exo_route",
      "bb7_exo_plan",
      "bb7_exo_preemptive_recovery",
      "bb7_workspace_context_loader",
      "bb7_session_intelligence",
      "bb7_read_file",
      "bb7_write_file",
      "bb7_append_file",
      "bb7_memory_store"
    ],
    "unused_categories": [],
    "rationale": "Planner-initiated Stage D bridge with continuity updates, caveat capture, and prompt-pack delivery."
  }
}
