{
  "run_id": "moonshine_mash_distill_20260217_r1",
  "stage_id": "planner_contract_v1",
  "role": "planner_reasoner",
  "state_hash_in": "source_sha256:4e6d44cd2102d26701858f832ba325e15d3490e61397013b7896a22dfad792dd",
  "state_hash_out": "plan_id:plan_1771318838_2",
  "files_changed": [
    "docs/HANDOFF_SCHEMA.json",
    "docs/MOONSHINE_DISTRIBUTED_PLAN_20260217.md",
    "docs/HANDOFF_PACKET_20260217_PLANNER_REASONER.json",
    "CONTEXT.md",
    "MEMORY.md",
    "STATE_SNAPSHOT_20260217.md",
    "docs/STATE_SNAPSHOT_20260217.md"
  ],
  "verification": {
    "checks": [
      "read CONTEXT.md and MEMORY.md",
      "read PROJECT_MOONSHINE_UPDATE_1.json",
      "read file-processor/moonshine_output.py",
      "read token_forensics_agents.py",
      "read current reports token manifests",
      "ran BB7 exoskeleton open sequence and preemptive recovery"
    ],
    "status": "pass",
    "evidence": [
      "best_plan_id=plan_1771318838_2",
      "preemptive_recovery overall_risk_score=0.0",
      "authoritative token_forensics total_tokens=115330530"
    ]
  },
  "result": {
    "summary": "Planner contract established for dual Kimi execution lanes plus Claude finishing lane, with canonical token-ledger gating and explicit handoff protocol.",
    "artifacts": [
      "docs/MOONSHINE_DISTRIBUTED_PLAN_20260217.md",
      "docs/HANDOFF_SCHEMA.json"
    ],
    "risks": [
      "token baseline drift across artifacts",
      "legacy mixed manifests in reports can cause misreads",
      "moonshine analyzer still contains heuristic-only fields"
    ]
  },
  "next_actions": [
    "Dispatch Stage A section to Kimi OpenCode agent",
    "Dispatch Stage B section to Kimi Code agent",
    "Collect both builder packets and return for planner drift review",
    "After planner approval, pass consolidated package to Claude finisher"
  ],
  "signal_type": "forward",
  "coverage": {
    "selected_tools": [
      "bb7_exo_bootstrap",
      "bb7_exo_list_tool_categories",
      "bb7_exo_category_specific_tools",
      "bb7_memory_intelligent_search",
      "bb7_exo_route",
      "bb7_exo_plan",
      "bb7_exo_preemptive_recovery",
      "bb7_read_file",
      "bb7_search_files",
      "bb7_write_file",
      "bb7_append_file",
      "bb7_memory_store",
      "bb7_exo_reflect"
    ],
    "unused_categories": [
      "visual",
      "web",
      "sessions"
    ],
    "rationale": "Task was planning and state synthesis; visual/web/session operations were not required for this stage."
  }
}
