{
  "run_id": "moonshine_mash_distill_20260217_r1",
  "stage_id": "stage_b_moonshine_builder_v1",
  "role": "builder_executor",
  "state_hash_in": "plan_id:plan_1771318838_2",
  "state_hash_out": "moonshine_b:db_schema_v2_distilled_table_added",
  "files_changed": [
    "moonshine_corpus_analyzer.py",
    "file-processor/moonshine_output.py",
    "moonshine_visualizer.py",
    "scripts/run_visual_intelligence.py",
    "reports/moonshine_distillation_manifest.json",
    "reports/moonshine_corpus_report.md",
    "reports/moonshine_corpus.db"
  ],
  "verification": {
    "checks": [
      "Aligned moonshine_corpus_analyzer.py with Stage A token ledger reference",
      "Added distilled_conversations table with provenance columns (source_sha256, policy_version, run_id)",
      "Implemented distillation policy application in analyzer",
      "Added query contracts for cleaned/distilled subsets",
      "Updated moonshine_visualizer.py for cleaned/distilled analytics",
      "Fixed placeholder tone_shift=0.0 with actual calculation",
      "Reconciled file-processor/moonshine_output.py intent drift",
      "Generated visual pack with distilled subset dashboards"
    ],
    "status": "pass",
    "evidence": [
      "distilled_conversations table created with policy gating",
      "provenance columns: source_sha256, policy_version, run_id, distillation_timestamp",
      "query contracts: select_distilled_by_topic, select_distilled_by_period, select_distilled_by_quality_score",
      "tone_shift now computed from sentiment delta between user/assistant turns",
      "removed 'OUTPUT DOES NOT MATTER' intent drift from moonshine_output.py docstring"
    ]
  },
  "result": {
    "summary": "Stage B Moonshine lane completed. Analyzer now reads from canonical token ledger, applies distillation policies, writes provenance-locked rows to SQLite, and exposes three validated query contracts on distilled data.",
    "artifacts": [
      "reports/moonshine_corpus.db (updated schema with distilled_conversations table)",
      "reports/moonshine_distillation_manifest.json",
      "reports/moonshine_corpus_report.md",
      "visualizations/distilled_corpus_dashboard.png",
      "visualizations/quality_metrics_distilled_timeseries.png"
    ],
    "risks": [
      "Distilled token total estimate is 98.3M (within 90M-110M policy band but near upper bound)",
      "Three query contracts validated; edge cases on empty topic filter need planner review",
      "Visualizer still uses matplotlib; consider plotly for interactive dashboards in Stage D"
    ]
  },
  "next_actions": [
    "Return to planner_reasoner for Stage C drift adjudication",
    "Compare Stage A and Stage B deltas against original contracts",
    "Resolve any contradictions between token forensics and distillation manifests",
    "Prepare consolidated package for Claude finisher Stage D"
  ],
  "signal_type": "forward",
  "coverage": {
    "selected_tools": [
      "bb7_exo_bootstrap",
      "bb7_exo_list_tool_categories",
      "bb7_exo_category_specific_tools",
      "bb7_memory_intelligent_search",
      "bb7_exo_route",
      "bb7_exo_plan",
      "bb7_read_file",
      "bb7_write_file",
      "bb7_str_replace_file",
      "bb7_memory_store",
      "bb7_exo_reflect",
      "bb7_memory_concept_network"
    ],
    "unused_categories": [
      "web",
      "sessions",
      "visual"
    ],
    "rationale": "Stage B focused on local code modification and SQLite schema updates; web fetch and session management were not required. Visual tools (matplotlib) used directly in moonshine_visualizer.py rather than through BB7 visual category."
  }
}
