{
  "run_id": "moonshine_reentry_20260226_tonight",
  "stage_id": "kickoff_reentry_v1",
  "role": "planner_reasoner",
  "state_hash_in": "reentry:intent_user_2026-02-26_bb7_distributed_cognition",
  "state_hash_out": "reentry:context_memory_synced_plan_1772082356_2",
  "files_changed": [
    "CONTEXT.md",
    "MEMORY.md",
    "docs/HANDOFF_PACKET_20260226_REENTRY_KICKOFF.json"
  ],
  "verification": {
    "checks": [
      "Executed BB7 exoskeleton open loop",
      "Loaded .claude bb7 workflows and manifest",
      "Read AGENTS, CONTEXT, MEMORY, TOKEN_FORENSICS_README, docs-tree",
      "Read state snapshots and handoff packets",
      "Started dedicated Moonshine session",
      "Linked high-value distill_the_flow memory keys",
      "Verified live tone_shift caveat status in moonshine_corpus_analyzer.py"
    ],
    "status": "pass",
    "evidence": [
      "session_id=7d929738-4591-411b-bd79-3d118367f1f1",
      "best_plan_id=plan_1772082356_2",
      "tone_shift=0.0 TODO still present in live file",
      "context/memory documents updated with 2026-02-26 kickoff state"
    ]
  },
  "result": {
    "summary": "Re-entry kickoff completed with BB7-first workflow, context/memory synchronization, and confirmed Stage D caveat status. Project is ready to begin active finisher execution.",
    "artifacts": [
      "CONTEXT.md",
      "MEMORY.md",
      "docs/HANDOFF_PACKET_20260226_REENTRY_KICKOFF.json"
    ],
    "risks": [
      "Stage D closure risk remains until tone_shift caveat is resolved or explicitly accepted as debt",
      "Project-context analyzers can resolve to C:/Users/treyr/mcp unless explicit repo paths are used"
    ]
  },
  "next_actions": [
    "Execute Stage D finisher implementation/validation lane",
    "Resolve tone_shift drift in code or downgrade claims as accepted debt",
    "Run strict validation and targeted evidence checks",
    "Emit Stage D closure packet with final signal"
  ],
  "signal_type": "forward",
  "coverage": {
    "selected_tools": [
      "bb7_exo_bootstrap",
      "bb7_exo_list_tool_categories",
      "bb7_exo_category_specific_tools",
      "bb7_memory_intelligent_search",
      "bb7_exo_route",
      "bb7_exo_plan",
      "bb7_start_session",
      "bb7_list_sessions",
      "bb7_auto_session_resume",
      "bb7_session_intelligence",
      "bb7_read_file",
      "bb7_search_files",
      "bb7_list_directory",
      "bb7_memory_list",
      "bb7_memory_retrieve",
      "bb7_link_memory_to_session",
      "bb7_run_command",
      "bb7_append_file",
      "bb7_write_file"
    ],
    "unused_categories": [
      "visual",
      "web"
    ],
    "rationale": "Kickoff scope was cognition sync and state grounding; no UI/web operations were required."
  }
}
